{
  "$schema": "../../../schemas/fleet-run.schema.json",
  "artifacts": [
    ".gradient/runs/run-021-domain-tagged-degrade-policy-20260518t204049z/artifacts/git-status.txt",
    ".gradient/runs/run-021-domain-tagged-degrade-policy-20260518t204049z/artifacts/git-diff-stat.txt",
    ".gradient/runs/run-021-domain-tagged-degrade-policy-20260518t204049z/artifacts/validate.txt"
  ],
  "backend": "codex-local",
  "context_bundle_id": "context-021-domain-tagged-degrade-policy-20260518t204049z",
  "ended_at": "2026-05-18T20:40:49Z",
  "events": [
    {
      "at": "2026-05-18T20:40:49Z",
      "summary": "Captured local supervised work.",
      "type": "start"
    },
    {
      "at": "2026-05-18T20:40:49Z",
      "summary": "Ran gradient validate.",
      "type": "validation"
    },
    {
      "at": "2026-05-18T20:40:49Z",
      "summary": "Evidence capture completed.",
      "type": "complete"
    }
  ],
  "harness_id": "thinktank-solo-frontier",
  "id": "run-021-domain-tagged-degrade-policy-20260518t204049z",
  "operator": "local-supervised",
  "started_at": "2026-05-18T20:40:49Z",
  "status": "succeeded",
  "trace_refs": [],
  "work_item_ids": [
    "021-domain-tagged-degrade-policy"
  ]
}
